{
  "lessonId": "G3-1",

  "metadata": {
    "grade": 3,
    "weekNumber": 1,
    "lessonNumber": 1,
    "duration": 50,
    "mathConcept": "Place value, compare/order numbers",
    "geometricConcept": "Circle partitions; equal grouping",
    "civilization": "Prehistoric",
    "standards": {
      "ccss": ["3.NBT.A.1", "3.NBT.A.2"],
      "ncas": ["VA:Cr2.1.3a", "VA:Re7.2.3a"]
    },
    "keywords": ["place value", "circle", "partition", "spiral", "prehistoric", "Newgrange", "radial symmetry"]
  },

  "sel": {
    "prompt": "Draw a circle and divide it into sections that show how you feel today. How many sections did you make? Why?",
    "duration": 5,
    "materials": ["Paper", "Compass or circular template", "Colored pencils"],
    "reflectionQuestions": [
      "Did anyone divide their circle the same way you did?",
      "What would happen if we all divided our circles into exactly 8 parts?"
    ]
  },

  "hook": {
    "character": {
      "name": "Kira the Cave Keeper",
      "role": "Prehistoric storyteller who counts days by hand marks",
      "imageUrl": "assets/characters/kira-cave-keeper.png",
      "biography": "Kira lives 5,000 years ago and uses spirals and circles to track seasons, moon cycles, and important hunts."
    },
    "narrative": "Kira stares at the full moon through the cave opening. She's been marking each moon on a spiral carved into stone—one mark per cycle. But tonight she realizes: if she divides the circle into 12 equal parts, she can predict the seasons! Her tribe will know when to plant, when to hunt, and when to celebrate.",
    "duration": 5,
    "visualType": "illustration",
    "questionPrompt": "How did Kira turn counting into circle thinking?"
  },

  "myth": {
    "title": "The Spiral Path of Memory",
    "civilization": "Prehistoric (Newgrange, Ireland)",
    "summary": "Ancient peoples carved triple spirals into stone to mark important cycles: day/night, seasons, life/death. These weren't just decorations—they were early calendars and memory systems.",
    "scenes": [
      {
        "sceneId": "scene-01",
        "imageUrl": "assets/myth/G3-1-scene-01-spiral-stone.jpg",
        "caption": "The triple spiral carved at Newgrange, Ireland (ca. 3200 BCE)",
        "narration": "Five thousand years ago, people in Ireland carved spirals into massive stones. Each spiral turn represented a cycle—the sun's journey, the moon's phases, the seasons' rotation.",
        "geometricFocus": "Spiral as cyclical path; center point"
      },
      {
        "sceneId": "scene-02",
        "imageUrl": "assets/myth/G3-1-scene-02-handprints.jpg",
        "caption": "Cave handprints arranged in patterns (Chauvet Cave, France)",
        "narration": "In caves across Europe, hunters left handprints arranged in circles and arcs. Were they counting? Marking territory? Creating a calendar of hunts?",
        "geometricFocus": "Radial arrangement around implied center"
      },
      {
        "sceneId": "scene-03",
        "imageUrl": "assets/myth/G3-1-scene-03-moon-count.jpg",
        "caption": "Notched bone showing moon counts (Paleolithic)",
        "narration": "On a piece of bone, someone scratched 28 marks—exactly one lunar cycle. By arranging these marks in a circle, they created one of humanity's first clocks.",
        "geometricFocus": "Division of circle into equal sectors"
      },
      {
        "sceneId": "scene-04",
        "imageUrl": "assets/myth/G3-1-scene-04-seasonal-wheel.jpg",
        "caption": "Stone circle marking seasonal alignments",
        "narration": "Standing stones formed giant circles. At sunrise on the winter solstice, light would pass through a specific gap—marking the year's shortest day and the promise of spring's return.",
        "geometricFocus": "360-degree thinking; angles mark time"
      },
      {
        "sceneId": "scene-05",
        "imageUrl": "assets/myth/G3-1-scene-05-kira-teaching.jpg",
        "caption": "Kira shares her circle calendar with the tribe",
        "narration": "Kira teaches her tribe: 'Divide the circle into 12 parts—one for each moon. When we mark each new moon, we'll know exactly when to prepare for winter.' The circle becomes a tool for survival.",
        "geometricFocus": "Circle partitioned into 12 equal sectors"
      }
    ],
    "sources": [
      {
        "title": "Newgrange: Archaeology, Art and Legend",
        "author": "Michael J. O'Kelly",
        "citation": "Thames & Hudson, 1982"
      },
      {
        "title": "The Roots of Civilization",
        "author": "Alexander Marshack",
        "url": "https://archive.org/details/rootsofcivilizat00mars"
      }
    ]
  },

  "artifacts": [
    {
      "artifactId": "artifact-01",
      "title": "Newgrange Triple Spiral",
      "civilization": "Prehistoric Ireland",
      "period": "ca. 3200 BCE (Neolithic)",
      "imageUrl": "assets/artifacts/newgrange-triple-spiral.jpg",
      "overlays": [
        {
          "overlayId": "overlay-01",
          "type": "circles",
          "elements": [
            {
              "shape": "circle",
              "coordinates": {"cx": "50%", "cy": "50%", "r": "5%"},
              "label": "Center point",
              "style": {"stroke": "#FF0000", "strokeWidth": 3}
            },
            {
              "shape": "circle",
              "coordinates": {"cx": "50%", "cy": "50%", "r": "15%"},
              "label": "First turn"
            },
            {
              "shape": "circle",
              "coordinates": {"cx": "50%", "cy": "50%", "r": "25%"},
              "label": "Second turn"
            },
            {
              "shape": "circle",
              "coordinates": {"cx": "50%", "cy": "50%", "r": "35%"},
              "label": "Third turn"
            }
          ],
          "description": "Concentric circles reveal the spiral's expansion pattern—each ring grows by approximately the same amount."
        },
        {
          "overlayId": "overlay-02",
          "type": "lines",
          "elements": [
            {
              "shape": "line",
              "coordinates": {"x1": "50%", "y1": "50%", "x2": "50%", "y2": "15%"},
              "label": "Direction markers"
            },
            {
              "shape": "arc",
              "coordinates": {"startAngle": 0, "endAngle": 360, "turns": 3},
              "label": "Spiral path"
            }
          ],
          "description": "The spiral moves outward at a constant rate—early understanding of growth patterns."
        }
      ],
      "metadata": {
        "source": "Wikimedia",
        "museum": "Brú na Bóinne Visitor Centre",
        "accessionNumber": "N/A (in situ)",
        "photographer": "Martin McCarthy",
        "license": "CC BY-SA 4.0",
        "url": "https://commons.wikimedia.org/wiki/File:Newgrange_Triple_Spiral.jpg"
      },
      "teachingNotes": "Point out: (1) Center point as origin; (2) Equal spacing of turns; (3) Direction (clockwise); (4) How this relates to equal grouping in place value."
    },
    {
      "artifactId": "artifact-02",
      "title": "Chauvet Cave Handprints",
      "civilization": "Prehistoric France",
      "period": "ca. 30,000 BCE (Upper Paleolithic)",
      "imageUrl": "assets/artifacts/chauvet-handprints.jpg",
      "overlays": [
        {
          "overlayId": "overlay-01",
          "type": "circles",
          "elements": [
            {
              "shape": "circle",
              "coordinates": {"cx": "45%", "cy": "48%", "r": "30%"},
              "label": "Implied center",
              "style": {"strokeDasharray": "5,5"}
            }
          ],
          "description": "Though no circle is drawn, the handprints create a radial pattern around an invisible center."
        },
        {
          "overlayId": "overlay-02",
          "type": "lines",
          "elements": [
            {
              "shape": "line",
              "coordinates": {"x1": "45%", "y1": "48%", "x2": "25%", "y2": "30%"},
              "label": "Radii to each hand"
            },
            {
              "shape": "line",
              "coordinates": {"x1": "45%", "y1": "48%", "x2": "65%", "y2": "35%"}
            },
            {
              "shape": "line",
              "coordinates": {"x1": "45%", "y1": "48%", "x2": "50%", "y2": "68%"}
            },
            {
              "shape": "line",
              "coordinates": {"x1": "45%", "y1": "48%", "x2": "35%", "y2": "60%"}
            }
          ],
          "description": "Lines from center to each handprint show equal grouping—dividing space into sectors."
        }
      ],
      "metadata": {
        "source": "Wikimedia",
        "museum": "Chauvet Cave, France",
        "accessionNumber": "N/A (in situ)",
        "license": "Public Domain",
        "url": "https://commons.wikimedia.org/wiki/Chauvet_Cave"
      },
      "teachingNotes": "Ask: 'How many handprints? How could we organize them by groups?' Connect to place value grouping (e.g., 2 groups of 5 = 10)."
    }
  ],

  "mathActivity": {
    "title": "Circle Division: Place Value Groups",
    "objective": "Students will partition circles into equal groups and connect this to place value grouping (tens and ones).",
    "procedure": [
      "Distribute pre-printed circles (8 inches diameter) and rulers.",
      "Review: 'Place value means grouping. 10 ones = 1 ten. But how do we show this visually?'",
      "Demonstrate: Draw a circle. Mark the center. Divide into 10 equal sectors using a protractor (36° each).",
      "Students practice: Create a circle divided into 10 parts. Label each sector 1, 2, 3... 10.",
      "Challenge: 'If each sector represents 10, how many total if we count all sectors?' (100)",
      "Extension: Divide a second circle into 100 tiny sectors. Compare the two circles. How does grouping by 10s make counting easier?"
    ],
    "duration": 15,
    "materials": [
      "Pre-printed 8-inch circles (1 per student)",
      "Rulers",